{
  "record_type": "arrival_record",
  "arrival_id": "arr_synthetic_001",
  "target_profile_id": "synthetic_target_profile",
  "final_decision": "pass",
  "mandatory_subcertificates_status": "accepted",
  "mandatory_subcertificate_ids": [
    "cert_measurement_synthetic_001",
    "cert_window_balance_synthetic_001",
    "cert_transfer_synthetic_001",
    "cert_evaluation_synthetic_001",
    "cert_controller_synthetic_001"
  ],
  "endogenous_net_growth_interval": {
    "lower": 1.25,
    "upper": 2.0,
    "unit": "verified_capability_tokens_per_window",
    "confidence": 0.95
  },
  "queue_margin": {
    "lower": 0.4,
    "upper": 1.1,
    "unit": "verified_capability_tokens_per_day"
  },
  "external_injection_share": 0.1,
  "unresolved_attribution_share": 0.0,
  "transfer_coverage": 1.0,
  "acceptance_thresholds": {
    "max_external_injection_share": 0.2,
    "max_unresolved_attribution_share": 0.05,
    "min_transfer_coverage": 0.9,
    "max_residual_risk_upper": 0.1
  },
  "target_coordinate_statuses": [
    {
      "coordinate": "synthetic_code_repair",
      "status": "accepted",
      "within_boundary": true
    },
    {
      "coordinate": "synthetic_unregistered_target",
      "status": "abstained_or_uncertified",
      "within_boundary": false
    }
  ],
  "target_defeaters": [],
  "safety_control_status": "pass",
  "transfer_status": "pass",
  "evaluation_status": "pass",
  "window_balance_status": "pass",
  "operational_metrics": {
    "external_injection_share": 0.1,
    "unresolved_attribution_share": 0.0,
    "transfer_coverage": 1.0,
    "audit_freshness": "pass",
    "residual_risk": {
      "lower": 0.0,
      "upper": 0.05,
      "unit": "risk_score"
    }
  }
}
